{
  "$schema": "../schema/recommendation-policy-base.schema.json",
  "schemaVersion": 1,
  "scoring": {
    "demandMatchCap": 40,
    "portfolioFitMultiplier": 42,
    "trustDivisor": 10,
    "sourcePriorityDivisor": 12,
    "authorityWeights": {
      "trusted-local": 38,
      "official-first-party": 58,
      "official-marketplace": 48,
      "official-compatible": 42,
      "trusted-community": 26,
      "unverified-community": 8
    },
    "compatibilityWeights": {
      "native": 24,
      "adaptable": 18,
      "partial": 8,
      "reference-only": -8,
      "incompatible": -30
    },
    "costPenalties": {
      "tiny": 0,
      "small": 2,
      "medium": 7,
      "large": 14
    },
    "demandSignalWeights": {
      "languages": 4,
      "packageManagers": 2,
      "frameworks": 10,
      "concerns": 4,
      "tooling": 3
    },
    "riskLevelPenalties": {
      "low": 0,
      "medium": 5,
      "high": 12
    },
    "riskFlagPenalties": {
      "hasHooks": 4,
      "hasExecScripts": 4,
      "requiresNetwork": 3
    },
    "freshness": {
      "recentDays": 45,
      "recentBoost": 6,
      "staleDays": 240,
      "stalePenalty": 6,
      "unknownPenalty": 2
    },
    "genericCapabilityPenalty": 10,
    "lowFitPenaltyThreshold": 0.35,
    "lowFitPenalty": 8,
    "weakDemandPenalty": 16,
    "outOfDomainGroupPenalty": 18,
    "coverageGainWeight": 2,
    "sourceDiversityBonus": 6,
    "overlapPenalty": 6,
    "demandTermMultipliers": {
      "actor-development": 1.25,
      "apify": 1.35,
      "backend": 0.8,
      "api-design": 0.9,
      "fullstack": 0.85,
      "database": 1,
      "authentication": 1.05,
      "e2e-testing": 0.85,
      "containerization": 1.1,
      "debugging": 1.1,
      "docker": 1.15,
      "duckdb": 1.15,
      "infrastructure": 1.1,
      "integration": 0.75,
      "javascript": 0.55,
      "java": 0.55,
      "go": 0.55,
      "rust": 0.55,
      "csharp": 0.55,
      "node-backend": 1.15,
      "python-backend": 1.15,
      "nextjs": 1.05,
      "supabase": 1.05,
      "orm": 1,
      "ai-sdk": 1,
      "express": 1.05,
      "fastify": 1.05,
      "nestjs": 1.05,
      "hono": 1.05,
      "fastapi": 1.05,
      "django": 1.05,
      "flask": 1.05,
      "litestar": 1.05,
      "testing": 0.8,
      "typescript": 0.55,
      "webhook": 1.25,
      "knowledge-base": 1.05,
      "documentation": 1.05,
      "research": 1.1,
      "writing": 0.9,
      "notebooks": 1.15,
      "data-science": 1.15,
      "data-engineering": 1.2,
      "media": 0.9,
      "design-assets": 0.9,
      "creative-production": 0.9,
      "cad": 1.1,
      "hardware": 1.1,
      "engineering": 1.05,
      "game-development": 1.05,
      "realtime-media": 0.95,
      "publishing": 0.9,
      "machine-learning": 1.2,
      "model-artifacts": 1.1,
      "ai": 1.15,
      "mobile": 1.05,
      "python": 0.75,
      "swift": 0.75,
      "objective-c": 0.75,
      "kotlin": 0.75,
      "cocoapods": 0.8,
      "swiftpm": 0.8,
      "xcode": 0.8,
      "maui": 1.05,
      "xamarin": 1,
      "dotnet-maui": 1,
      "android-gradle": 0.85,
      "pub": 0.75,
      "jupyter": 1.05,
      "asset-pipeline": 0.9,
      "godot": 1.05,
      "game-engine": 1.05,
      "latex": 0.9,
      "android": 1.05,
      "ios": 1.05,
      "cloud": 1.05,
      "aws": 1.05,
      "gcp": 1.05,
      "firebase": 1.05,
      "blockchain": 1,
      "web3": 1,
      "cryptography": 1.05,
      "pentesting": 1.1,
      "robotics": 1.15,
      "systems-engineering": 1.05,
      "deep-learning": 1.15,
      "reinforcement-learning": 1.1,
      "marketing": 0.85,
      "seo": 0.9,
      "lead-generation": 0.9,
      "content-creation": 0.85,
      "test-runner": 0.8,
      "actor-runtime": 1,
      "networking": 1,
      "business-analysis": 0.9,
      "3d-printing": 1.05,
      "fabrication": 1,
      "frontend-tooling": 0.9,
      "java-backend": 1.1,
      "dotnet-backend": 1.1,
      "go-backend": 1.1,
      "rust-backend": 1.1,
      "backend-framework": 1,
      "data-platform": 1.05,
      "design-systems": 0.95,
      "3d-assets": 1.05,
      "additive-manufacturing": 1.05,
      "analytics-engineering": 1.05,
      "ansible": 1.05,
      "audio-production": 1.05,
      "autonomy": 1.05,
      "backtesting": 1.05,
      "blog": 1.05,
      "business-intelligence": 1.05,
      "cairo": 1.05,
      "campaigns": 1.05,
      "ci-cd": 1.05,
      "cms": 1.05,
      "cnc": 1.05,
      "computer-vision": 1.05,
      "container-security": 1.05,
      "content-marketing": 1.05,
      "cosmwasm": 1.05,
      "dashboarding": 1.05,
      "data-mining": 1.05,
      "data-quality": 1.05,
      "defi": 1.05,
      "dns": 1.05,
      "drones": 1.05,
      "elt": 1.05,
      "embedded": 1.05,
      "ethereum": 1.05,
      "etl": 1.05,
      "financial-data": 1.05,
      "firewall": 1.05,
      "firmware": 1.05,
      "generative-art": 1.05,
      "helm": 1.05,
      "image-processing": 1.05,
      "iot": 1.05,
      "klipper": 1.05,
      "lakehouse": 1.05,
      "looker": 1.05,
      "malware-analysis": 1.05,
      "market-analysis": 1.05,
      "mlops": 1.05,
      "model-evaluation": 1.05,
      "model-serving": 1.05,
      "model-training": 1.05,
      "motion-planning": 1.05,
      "move": 1.05,
      "music": 1.05,
      "netops": 1.05,
      "network-automation": 1.05,
      "nlp": 1.05,
      "orchestration": 1.05,
      "osint": 1.05,
      "platform-engineering": 1.05,
      "policy-as-code": 1.05,
      "pulumi": 1.05,
      "quant-finance": 1.05,
      "rag": 1.05,
      "reporting": 1.05,
      "reverse-engineering": 1.05,
      "routing": 1.05,
      "rtos": 1.05,
      "sast": 1.05,
      "secret-scanning": 1.05,
      "simulation": 1.05,
      "slam": 1.05,
      "slicer": 1.05,
      "smart-contracts": 1.05,
      "solana": 1.05,
      "streaming": 1.05,
      "substrate": 1.05,
      "systems-programming": 1.05,
      "tableau": 1.05,
      "trading": 1.05,
      "vector-search": 1.05,
      "vfx": 1.05,
      "video-production": 1.05,
      "vpn": 1.05,
      "vulnerability-management": 1.05,
      "wallet": 1.05,
      "php": 1,
      "ruby": 1,
      "erlang": 1,
      "elixir": 1,
      "julia": 1,
      "c": 1,
      "cpp": 1,
      "cmake": 1,
      "make": 1,
      "hex": 1,
      "rebar": 1,
      "julia-pkg": 1,
      "wordpress": 1,
      "drupal": 1,
      "joomla": 1,
      "codeigniter": 1,
      "laminas": 1,
      "zend": 1,
      "cakephp": 1,
      "yii2": 1,
      "scientific-computing": 1
    }
  },
  "hostDefaults": {
    "suppressedAssetIdPatterns": [
      "brand-voice",
      "crosspost",
      "article-writing"
    ],
    "suppressedCapabilityTerms": ["linkedin", "social-media"]
  },
  "presets": {
    "targetConcerns": {
      "delivery-core": [
        {
          "concern": "backend",
          "minimum": 6,
          "weight": 4
        },
        {
          "concern": "integration",
          "minimum": 5,
          "weight": 3
        },
        {
          "concern": "testing",
          "minimum": 5,
          "weight": 3
        },
        {
          "concern": "security",
          "minimum": 4,
          "weight": 2
        },
        {
          "concern": "infra",
          "minimum": 4,
          "weight": 2
        }
      ],
      "shared-runtime": [
        {
          "concern": "integration",
          "minimum": 8,
          "weight": 4
        },
        {
          "concern": "security",
          "minimum": 4,
          "weight": 3
        },
        {
          "concern": "infra",
          "minimum": 4,
          "weight": 2
        },
        {
          "concern": "data",
          "minimum": 3,
          "weight": 2
        }
      ]
    }
  },
  "concernKeywordMap": {
    "frontend": [
      "frontend",
      "react",
      "nextjs",
      "vue",
      "angular",
      "svelte",
      "astro",
      "ui",
      "accessibility",
      "frontend-tooling",
      "design-systems"
    ],
    "backend": [
      "api",
      "api-design",
      "apify",
      "backend",
      "backend-framework",
      "cakephp",
      "codeigniter",
      "csharp",
      "django",
      "dotnet-backend",
      "elixir",
      "erlang",
      "express",
      "fastapi",
      "flask",
      "fullstack",
      "go",
      "go-backend",
      "java",
      "java-backend",
      "laminas",
      "litestar",
      "node-backend",
      "php",
      "python-backend",
      "ruby",
      "rust",
      "rust-backend",
      "webhook",
      "yii2",
      "zend"
    ],
    "integration": [
      "integration",
      "webhook",
      "mcp",
      "connector",
      "workflow",
      "servicebus",
      "eventhub"
    ],
    "data": [
      "analytics",
      "analytics-engineering",
      "cosmos",
      "data",
      "data-engineering",
      "data-mining",
      "data-platform",
      "data-quality",
      "data-science",
      "database",
      "duckdb",
      "elt",
      "etl",
      "julia",
      "jupyter",
      "lakehouse",
      "orchestration",
      "orm",
      "postgres",
      "scientific-computing",
      "sql",
      "streaming"
    ],
    "security": [
      "audit",
      "auth",
      "authentication",
      "container-security",
      "content-safety",
      "governance",
      "malware-analysis",
      "osint",
      "policy-as-code",
      "reverse-engineering",
      "sast",
      "secret-scanning",
      "security",
      "threat",
      "vulnerability-management"
    ],
    "docs": ["doc", "readme", "instruction", "guide", "reference"],
    "testing": [
      "test",
      "testing",
      "jest",
      "playwright",
      "qa",
      "debugging",
      "e2e-testing",
      "test-runner"
    ],
    "infra": [
      "ansible",
      "aws",
      "azure",
      "ci-cd",
      "cloud",
      "container",
      "devops",
      "docker",
      "firebase",
      "gcp",
      "helm",
      "infra",
      "kubernetes",
      "platform-engineering",
      "pulumi",